CFF_reference,Critical_appraisal_keep,Critical_appraisal,Class,Spname_common,Spname_raw,Species_phylo,Spname_accepted,habitat,forage_light_level,mode_of_life,mode-of_life_ref,body_mass_us,body_mass_ref,Method_raw,Method,CFF_value_type,CFF_raw,CFF_variability,CFF_variability_type,CFF,CFF_max,Comments_from_2022,,,,,,,,,,,,"Ali, M. A.; Kobayashi, H. 1968 Electroretinogram - Flicker fusion frequency in albino trout Electroretinogram - Flicker fusion frequency in albino trout Ali, M. A.; Kobayashi, H.",y,M,Actinopterygii,American brook charr,Salvelinus fontinalis,Salvelinus_fontinalis,"Salvelinus fontinalis Mitchill, 1814",pelagic,high,ballistic,"Farwell, M. and McLaughlin, R.L., 2009. Alternative foraging tactics and risk taking in brook charr (Salvelinus fontinalis). Behavioral Ecology, 20(5), pp.913-921.",214,fisebase_from_26.4cm_common_length,ERG,Electrophysiology,mean,~67.5,Unknown,NA,68,75,diagram reading of the mean for light adapted animals at maximum intensity of 600 ft-c; higher valuer for albinos for lower intensities; range of values (~59.58-74.98),,,,,,,,,,,,AULT S J; HOUSE E W 1987 ELECTRORETINOGRAPHIC RESPONSES OF THE GREAT HORNED OWL BUBO-VIRGINIANUS ELECTRORETINOGRAPHIC RESPONSES OF THE GREAT HORNED OWL BUBO-VIRGINIANUS AULT S J; HOUSE E W,y,H,Aves,Great horned owl,Bubo virginianus,Bubo_virginianus,"Bubo virginianus J.F.Gmelin, 1788",volant,low,ballistic,Handbook_birds_of_the_world,1377,amniote,ERG,Electrophysiology,range,35-45,Unknown,NA,40,45,"range and maximum photopic ; mean and SEscotopic = 16 ± 3,7 Hz",,,,,,,,,,,,"Behrend, Konstantin; Benkner, Boris; Mora-Ferrer, Carlos 2007 Temporal resolution and temporal transfer properties: Gabaergic and cholinergic mechanisms Temporal resolution and temporal transfer properties: Gabaergic and cholinergic mechanisms Behrend, Konstantin; Benkner, Boris; Mora-Ferrer, Carlos",y,M,Actinopterygii,Goldfish,Carassius auratus,Carassius_auratus,"Carassius auratus Linnaeus, 1758",pelagic,high,forage,"Fishbase description of Feed mainly on plankton, benthic invertebrates, plant material and detritus",16.65,fisebase_10cm common length,ERG,Electrophysiology,Unknown,~34,Unknown,NA,34,34,"FFF; ""the behavioral flicker fusion frequency, about 39 Hz, is approximately 5 Hz higher than the ERG-derived flicker fusion frequency""",,,,,,,,,,,,"Behrend, Konstantin; Benkner, Boris; Mora-Ferrer, Carlos 2007 Temporal resolution and temporal transfer properties: Gabaergic and cholinergic mechanisms Temporal resolution and temporal transfer properties: Gabaergic and cholinergic mechanisms Behrend, Konstantin; Benkner, Boris; Mora-Ferrer, Carlos",y,M,Actinopterygii,Goldfish,Carassius auratus,Carassius_auratus,"Carassius auratus Linnaeus, 1758",pelagic,high,forage,"Fishbase description of Feed mainly on plankton, benthic invertebrates, plant material and detritus",16.65,fisebase_10cm common length,Behavioural,Behavioural,range,39-40,Unknown,NA,39.5,40,FFF ; range for behavioural for half-maximal behavioural response,,,,,,,,,,,,"Bilotta, J; Lynd, FM; Powers, MK 1998 Effects of mean luminance on goldfish temporal contrast sensitivity Effects of mean luminance on goldfish temporal contrast sensitivity Bilotta, J; Lynd, FM; Powers, MK",y,M,Actinopterygii,Goldfish,Carassius auratus,Carassius_auratus,"Carassius auratus Linnaeus, 1758",pelagic,high,forage,"Fishbase description of Feed mainly on plankton, benthic invertebrates, plant material and detritus",16.65,fisebase_10cm common length,Behavioural,Behavioural,extrapolation,24,Unknown,NA,24,24,"at 10 cd/m 2, FFF ; ""The CFF at l0 cd/m 2, determined by extrapolating to find the temporal frequency detectable at 25% contrast (0.6 on the log contrast sensitivity axis), is about 24 Hz"" ; ""At a mean luminance of 10 -1 cd/m 2, the CFF was about 13 Hz. """,,,,,,,,,,,,"Bobkova, MV; Tartakovskaya, OS; Borissenko, SL; Zhukov, VV; Meyer-Rochow, VB 2004 Restoration of morphological and functional integrity in the regenerating eye of the giant African land snail Achatina fulica Restoration of morphological and functional integrity in the regenerating eye of the giant African land snail Achatina fulica Bobkova, MV; Tartakovskaya, OS; Borissenko, SL; Zhukov, VV; Meyer-Rochow, VB",y,M,Gastropoda,Giant African Snail,Achatina fulica,Achatina_fulica,"Lissachatina fulica Bowdich, 1822",terrestrial,low,forage,"Herbivorous feeding behavior as described in Silva, G.M.D., Thiengo, S.C., Menezes, A.N., Melo, C.M.D. and Jeraldo, V.D.L.S., 2022. Relative condition factor and predictive model for the presence of the invasive snail Achatina (Lissachatina) fulica in Sergipe, Northeast Brazil. Biota Neotropica, 22(2), p.e20211323.",62.075,"mean from  Silva, G.M.D., Thiengo, S.C., Menezes, A.N., Melo, C.M.D. and Jeraldo, V.D.L.S., 2022. Relative condition factor and predictive model for the presence of the invasive snail Achatina (Lissachatina) fulica in Sergipe, Northeast Brazil. Biota Neotropica, 22(2), p.e20211323.",ERG,Electrophysiology,mean,0.57,0.08,NA,0.57,0.7,"""electrical response fused at""; variation: N = 9",,,,,,,,,,,,"Bok, Michael J.; Nilsson, Dan-Eric; Garm, Anders 2019 Photoresponses in the radiolar eyes of the fan worm Acromegalomma vesiculosum Photoresponses in the radiolar eyes of the fan worm Acromegalomma vesiculosum Bok, Michael J.; Nilsson, Dan-Eric; Garm, Anders",y,M,Polychaeta,fan_worm,Acromegalomma vesiculosum,Branchiomma_vesiculosum,"Acromegalomma vesiculosum Montagu, 1813",demersal,high,forage,"Deposite feeding from Bok, Michael J.; Nilsson, Dan-Eric; Garm, Anders 2019 Photoresponses in the radiolar eyes of the fan worm Acromegalomma vesiculosum Photoresponses in the radiolar eyes of the fan worm Acromegalomma vesiculosum Bok, Michael J.; Nilsson, Dan-Eric; Garm, Anders",2,needs estimated mass,ERG,Electrophysiology,range,30-35,Unknown,NA,32.5,35,"for radiolar eyes : range for 14 eyes ; averaged Fourier transform power curves, which cross a 5 % threshold at around 32 Hz; ""shallow"" waters",,,,,,,,,,,,I stopped here"Bostrom, Jannika E.; Dimitrova, Marina; Canton, Cindy; Hastad, Olle; Qvarnstrom, Anna; Odeen, Anders 2016 Ultra-Rapid Vision in Birds Ultra-Rapid Vision in Birds Bostrom, Jannika E.; Dimitrova, Marina; Canton, Cindy; Hastad, Olle; Qvarnstrom, Anna; Odeen, Anders",y,L,Aves,Eurasian blue tit,Cyanistes caeruleus,Parus_caeruleus,"Cyanistes caeruleus Linnaeus, 1758",volant,high,forage,Handbook_birds_of_the_world,11.2,amniote,Behavioural,Behavioural,mean,130.3,0.94,SD,130.3,131,mean at 1500 cd.m-2 ; maximum 131 Hz,,,,,,,,,,,,"Bostrom, Jannika E.; Dimitrova, Marina; Canton, Cindy; Hastad, Olle; Qvarnstrom, Anna; Odeen, Anders 2016 Ultra-Rapid Vision in Birds Ultra-Rapid Vision in Birds Bostrom, Jannika E.; Dimitrova, Marina; Canton, Cindy; Hastad, Olle; Qvarnstrom, Anna; Odeen, Anders",y,L,Aves,Collared flycatcher,Ficedula albicollis,Ficedula_albicollis,"Ficedula albicollis Temminck, 1815",volant,high,pursuit,Handbook_birds_of_the_world,10.85,amniote,Behavioural,Behavioural,mean,138.2,6.5,SD,138.2,141,mean at 1500 cd.m-2 ; maximum 141 Hz,,,,,,,,,,,,"Bostrom, Jannika E.; Dimitrova, Marina; Canton, Cindy; Hastad, Olle; Qvarnstrom, Anna; Odeen, Anders 2016 Ultra-Rapid Vision in Birds Ultra-Rapid Vision in Birds Bostrom, Jannika E.; Dimitrova, Marina; Canton, Cindy; Hastad, Olle; Qvarnstrom, Anna; Odeen, Anders",y,L,Aves,European pied flycatcher,Ficedula hypoleuca,Ficedula_hypoleuca,"Ficedula hypoleuca Pallas, 1764",volant,high,pursuit,Handbook_birds_of_the_world,12.775,amniote,Behavioural,Behavioural,mean,128.1,9.8,SD,128.1,146,mean at 1500 cd.m-2 ; maximum 146 Hz,,,,,,,,,,,,"Bostrom, Jannika E.; Haller, Nicola K.; Dimitrova, Marina; Odeen, Anders; Kelber, Almut 2017 The flicker fusion frequency of budgerigars (Melopsittacus undulatus) revisited The flicker fusion frequency of budgerigars (Melopsittacus undulatus) revisited Bostrom, Jannika E.; Haller, Nicola K.; Dimitrova, Marina; Odeen, Anders; Kelber, Almut",y,M,Aves,Budgerigar,Melopsittacus undulatus,Melopsittacus_undulatus,"Melopsittacus undulatus Shaw, 1805",volant,high,forage,Handbook_birds_of_the_world,29.05,amniote,Behavioural,Behavioural,range,77-93,Unknown,NA,85,93,range of individual values of CFF for each budgerigars; three birds had CFF at 3500 cd/m_ and one CFF at 93 Hz for 7200 cd/m_ so AL calculated a ponderated mean,,,,,,,,,,,,"Bourque, Stephane L.; Kuny, Sharee; Reyes, Laura M.; Davidge, Sandra T.; Sauve, Yves 2013 Prenatal Hypoxia Is Associated with Long-Term Retinal Dysfunction in Rats Prenatal Hypoxia Is Associated with Long-Term Retinal Dysfunction in Rats Bourque, Stephane L.; Kuny, Sharee; Reyes, Laura M.; Davidge, Sandra T.; Sauve, Yves",y,M,Mammalia,Brown rat,Rattus norvegicus,Rattus_norvegicus,"Rattus norvegicus Berkenhout, 1769",terrestrial,low,forage,Handbook_of_mammals_of_the_world,280,amniote,ERG,Electrophysiology,mean,42,1,SE,42,42,mean,,,,,,,,,,,,"Brill, Richard W.; Horodysky, Andrij Z.; Place, Allen R.; Larkin, Mary E. M.; Reimschuessel, Renate 2019 Effects of dietary taurine level on visual function in European sea bass (Dicentrarchus labrax) Effects of dietary taurine level on visual function in European sea bass (Dicentrarchus labrax) Brill, Richard W.; Horodysky, Andrij Z.; Place, Allen R.; Larkin, Mary E. M.; Reimschuessel, Renate",y,M,Actinopterygii,European bass,Dicentrarchus labrax,Dicentrarchus_labrax,"Dicentrarchus labrax Linnaeus, 1758",pelagic,high,ballistic,"Based on descriptions of diet Laffaille, P., Lefeuvre, J.C., Schricke, M.T. et al. Feeding ecology of o-group sea bass,Dicentrarchus labrax, in salt marshes of Mont Saint Michel Bay (France). Estuaries 24, 116–125 (2001). https://doi.org/10.2307/1352818",1430,fisebase_50cm common length,ERG,Electrophysiology,median,~116.9,Unknown,NA,117,154.6,diagram reading ; not maximal light intensity ; max: ~ 154.59 Hz and min at ~70.35 Hz,,,,,,,,,,,,"BULLOCK, TH; BUDELMANN, BU 1991 SENSORY EVOKED-POTENTIALS IN UNANESTHETIZED UNRESTRAINED CUTTLEFISH - A NEW PREPARATION FOR BRAIN PHYSIOLOGY IN CEPHALOPODS SENSORY EVOKED-POTENTIALS IN UNANESTHETIZED UNRESTRAINED CUTTLEFISH - A NEW PREPARATION FOR BRAIN PHYSIOLOGY IN CEPHALOPODS BULLOCK, TH; BUDELMANN, BU",y,H,Cephalopoda,Common cuttlefish,Sepia officinalis,Sepia_officinalis,"Sepia officinalis Linnaeus, 1758",demersal,high,ballistic,Sealifebase,1014.782,Based_on_sealifebase_at20cm_and_b_2.78_and_a_0.2427,EEG_electroencephalogram_and_Visual_Evoked_Potentials_VEP,Electrophysiology,maximum,<30,Unknown,NA,30,30,lower fusion frequency ; always lower than 30 Hz : maximum value,,,,,,,,,,,,"BULLOCK, TH; HOFMANN, MH; NEW, JG; NAHM, FK 1990 DYNAMIC PROPERTIES OF VISUAL EVOKED-POTENTIALS IN THE TECTUM OF CARTILAGINOUS AND BONY FISHES, WITH NEUROETHOLOGICAL IMPLICATIONS DYNAMIC PROPERTIES OF VISUAL EVOKED-POTENTIALS IN THE TECTUM OF CARTILAGINOUS AND BONY FISHES, WITH NEUROETHOLOGICAL IMPLICATIONS BULLOCK, TH; HOFMANN, MH; NEW, JG; NAHM, FK",y,M,Actinopterygii,Californian grunion,Leuresthes tenuis,Leuresthes_tenuis,"Leuresthes tenuis Ayres, 1860",pelagic,high,ballistic,"feeding_behavior_from_Higgins, B.A. and Horn, M.H. (2014), Suction among pickers: jaw mechanics, dietary breadth and feeding behaviour in beach-spawning Leuresthes spp. compared with their relatives. J Fish Biol, 84: 1689-1707. https://doi.org/10.1111/jfb.12385",17.57333,"Mass_based _on_mean_from_Johnson, P.B., Martin, K.L., Vandergon, T.L., Honeycutt, R.L., Burton, R.S. and Fry, A., 2009. Microsatellite and mitochondrial genetic comparisons between northern and southern populations of California grunion (Leuresthes tenuis). Copeia, 2009(3), pp.465-474.",ERG,Electrophysiology,minimum,> 60,Unknown,NA,60,60,individual lower fusion frequency (not averaged),,,,,,,,,,,,"BULLOCK, TH; HOFMANN, MH; NEW, JG; NAHM, FK 1990 DYNAMIC PROPERTIES OF VISUAL EVOKED-POTENTIALS IN THE TECTUM OF CARTILAGINOUS AND BONY FISHES, WITH NEUROETHOLOGICAL IMPLICATIONS DYNAMIC PROPERTIES OF VISUAL EVOKED-POTENTIALS IN THE TECTUM OF CARTILAGINOUS AND BONY FISHES, WITH NEUROETHOLOGICAL IMPLICATIONS BULLOCK, TH; HOFMANN, MH; NEW, JG; NAHM, FK",y,M,Actinopterygii,Grey mullet,Mugil cephalus,Mugil_cephalus,"Mugil cephalus Linnaeus, 1758",pelagic,high,forage,"Jamabo, N.A. and Maduako, N.C., 2015. Food and feeding habits of Mugil cephalus (linnaeus, 1758) in elechi creek, Niger delta, Nigeria. International Journal of Fisheries and Aquaculture, 7(3), pp.25-29.",1424,"Jamabo, N.A. and Maduako, N.C., 2015. Food and feeding habits of Mugil cephalus (linnaeus, 1758) in elechi creek, Niger delta, Nigeria. International Journal of Fisheries and Aquaculture, 7(3), pp.25-29.",ERG,Electrophysiology,minimum,> 100,Unknown,NA,100,100,individual lower fusion frequency (not averaged),,,,,,,,,,,,"BULLOCK, TH; HOFMANN, MH; NEW, JG; NAHM, FK 1990 DYNAMIC PROPERTIES OF VISUAL EVOKED-POTENTIALS IN THE TECTUM OF CARTILAGINOUS AND BONY FISHES, WITH NEUROETHOLOGICAL IMPLICATIONS DYNAMIC PROPERTIES OF VISUAL EVOKED-POTENTIALS IN THE TECTUM OF CARTILAGINOUS AND BONY FISHES, WITH NEUROETHOLOGICAL IMPLICATIONS BULLOCK, TH; HOFMANN, MH; NEW, JG; NAHM, FK",y,M,Actinopterygii,Barred sand bass,Paralabrax nebulifer,Paralabrax_nebulifer,"Paralabrax nebulifer Girard, 1854",demersal,high,ballistic,fishebase,6000,Based_on_single_entry_of_6kg_on_fishbase,ERG,Electrophysiology,minimum,>50,Unknown,NA,50,50,individual lower fusion frequency (not averaged),,,,,,,,,,,,"BULLOCK, TH; HOFMANN, MH; NEW, JG; NAHM, FK 1990 DYNAMIC PROPERTIES OF VISUAL EVOKED-POTENTIALS IN THE TECTUM OF CARTILAGINOUS AND BONY FISHES, WITH NEUROETHOLOGICAL IMPLICATIONS DYNAMIC PROPERTIES OF VISUAL EVOKED-POTENTIALS IN THE TECTUM OF CARTILAGINOUS AND BONY FISHES, WITH NEUROETHOLOGICAL IMPLICATIONS BULLOCK, TH; HOFMANN, MH; NEW, JG; NAHM, FK",y,M,Elasmobranchii,Thornback ray,Platyrhinoidis triseriata,Platyrhinoidis_triseriata,"Platyrhinoidis triseriata Jordan & Gilbert, 1880",demersal,low,forage,fishebase,2676,needs ref,ERG,Electrophysiology,range,30-60,Unknown,NA,45,60,"range of individual lower fusion frequency (not averaged) ; (""equivalent to the critical flicker frequency (CFF)"") ; more accurate determination not satisfactory ",,,,,,,,,,,,"BULLOCK, TH; HOFMANN, MH; NEW, JG; NAHM, FK 1990 DYNAMIC PROPERTIES OF VISUAL EVOKED-POTENTIALS IN THE TECTUM OF CARTILAGINOUS AND BONY FISHES, WITH NEUROETHOLOGICAL IMPLICATIONS DYNAMIC PROPERTIES OF VISUAL EVOKED-POTENTIALS IN THE TECTUM OF CARTILAGINOUS AND BONY FISHES, WITH NEUROETHOLOGICAL IMPLICATIONS BULLOCK, TH; HOFMANN, MH; NEW, JG; NAHM, FK",y,M,Elasmobranchii,Shovelnose guitarfish,Rhinobatos productus,Rhinobatos_productus,"Pseudobatos productus Ayres, 1854",demersal,low,forage,fishebase,9800,needs ref,ERG,Electrophysiology,maximum,<30,Unknown,NA,30,30,individual lower fusion frequency (not averaged),,,,,,,,,,,,"BULLOCK, TH; HOFMANN, MH; NEW, JG; NAHM, FK 1990 DYNAMIC PROPERTIES OF VISUAL EVOKED-POTENTIALS IN THE TECTUM OF CARTILAGINOUS AND BONY FISHES, WITH NEUROETHOLOGICAL IMPLICATIONS DYNAMIC PROPERTIES OF VISUAL EVOKED-POTENTIALS IN THE TECTUM OF CARTILAGINOUS AND BONY FISHES, WITH NEUROETHOLOGICAL IMPLICATIONS BULLOCK, TH; HOFMANN, MH; NEW, JG; NAHM, FK",y,M,Actinopterygii,Longspine thornyhead,Sebastolobus altivelis,Sebastolobus_altivelis,"Sebastolobus altivelis Gilbert, 1896",demersal,low,forage,feeds on brittlestars from COSEWIC 2007. COSEWIC assessment and status report on the longspine thornyhead Sebastolobus altivelis in Canada. Committee on the Status of Endangered Wildlife in Canada. Ottawa. vi + 27 pp. (www.sararegistry.gc.ca/status/status_e.cfm),104,"mean from Vetter, R.D. and Lynn, E.A., 1997. Bathymetric demography, enzyme activity patterns, and bioenergetics of deep-living scorpaenid fishes (genera Sebastes and Sebastolobus): paradigms revisited. Marine Ecology Progress Series, 155, pp.173-188.",ERG,Electrophysiology,Unknown,~10,Unknown,NA,10,10,"individual lower fusion frequency (not averaged); ""deep water""",,,,,,,,,,,,"BULLOCK, TH; HOFMANN, MH; NEW, JG; NAHM, FK 1990 DYNAMIC PROPERTIES OF VISUAL EVOKED-POTENTIALS IN THE TECTUM OF CARTILAGINOUS AND BONY FISHES, WITH NEUROETHOLOGICAL IMPLICATIONS DYNAMIC PROPERTIES OF VISUAL EVOKED-POTENTIALS IN THE TECTUM OF CARTILAGINOUS AND BONY FISHES, WITH NEUROETHOLOGICAL IMPLICATIONS BULLOCK, TH; HOFMANN, MH; NEW, JG; NAHM, FK",y,M,Actinopterygii,Yellowfin tuna,Thunnus albacares,Thunnus_albacares,"Thunnus albacares Bonnaterre, 1788",pelagic,high,pursuit,"Schaefer, K.M., Fuller, D.W. and Block, B.A., 2007. Movements, behavior, and habitat utilization of yellowfin tuna (Thunnus albacares) in the northeastern Pacific Ocean, ascertained through archival tag data. Marine Biology, 152, pp.503-525.",25317,"Schaefer, K.M., Fuller, D.W. and Block, B.A., 2007. Movements, behavior, and habitat utilization of yellowfin tuna (Thunnus albacares) in the northeastern Pacific Ocean, ascertained through archival tag data. Marine Biology, 152, pp.503-525.",ERG,Electrophysiology,range,60 - >100,Unknown,NA,80,100,range of individual lower fusion frequency (not averaged),,,,,,,,,,,,"Buschbeck, EK; Ehmer, B; Hoy, RR 2003 The unusual visual system of the Strepsiptera: external eye and neuropils The unusual visual system of the Strepsiptera: external eye and neuropils Buschbeck, EK; Ehmer, B; Hoy, RR",y,H,Insecta,NA,Xenos peckii,Xenos_peckii,"Xenos pecki Kirby, 1813",volant,high,forage,"Druart, G., Guérineau, N., Haïdar, R., Thétas, S., Taboury, J., Rommeluère, S., Primot, J. and Fendler, M., 2009. Demonstration of an infrared microcamera inspired by Xenos peckii vision. Applied optics, 48(18), pp.3368-3374.",0.00102,"Druart, G., Guérineau, N., Haïdar, R., Thétas, S., Taboury, J., Rommeluère, S., Primot, J. and Fendler, M., 2009. Demonstration of an infrared microcamera inspired by Xenos peckii vision. Applied optics, 48(18), pp.3368-3374.",ERG,Electrophysiology,mean,35,Unknown,NA,35,35,"""exceeds 35 Hz on average""; ""critical fusion frequency lies around""",,,,,,,,,,,,"Callahan, TL; Petry, HM 2000 Psychophysical measurement of temporal modulation sensitivity in the tree shrew (Tupaia belangeri) Psychophysical measurement of temporal modulation sensitivity in the tree shrew (Tupaia belangeri) Callahan, TL; Petry, HM",y,M,Mammalia,Northern treeshrew,Tupaia belangeri,Tupaia_belangeri,"Tupaia belangeri Wagner, 1841",arboreal,high,forage,"Collins, P.M. and Tsang, W.N., 1987. Growth and reproductive development in the male tree shrew (Tupaia belangeri) from birth to sexual maturity. Biology of Reproduction, 37(2), pp.261-267.",270,"Collins, P.M. and Tsang, W.N., 1987. Growth and reproductive development in the male tree shrew (Tupaia belangeri) from birth to sexual maturity. Biology of Reproduction, 37(2), pp.261-267.",Behavioural,Behavioural,minimum,>50,Unknown,NA,50,50,high frequency cut-off beyond 50 Hz ; 80-100 Hz for ERG in other studies from the 60's,,,,,,,,,,,,"CARVALHO, P. S. M.; NOLTIE, D. B.; TILLITT, D. E. 2004 Biochemical, histological and behavioural aspects of visual functioning during early development of rainbow trout Biochemical, histological and behavioural aspects of visual functioning during early development of rainbow trout CARVALHO, P. S. M.; NOLTIE, D. B.; TILLITT, D. E.",y,M,Actinopterygii,Rainbow trout,Oncorhynchus mykiss,Oncorhynchus_mykiss,"Oncorhynchus mykiss Walbaum, 1792",benthopelagic,low,ballistic,"Gabriel J. Rossi, Mary E. Power, Shelley Pneh, Jason R. Neuswanger, and Timothy J. Caldwell. 2021. Foraging modes and movements of Oncorhynchus mykiss as flow and invertebrate drift recede in a California stream. Canadian Journal of Fisheries and Aquatic Sciences. 78(8): 1045-1056. ",2391.21,fisebase_60cm common length,Behavioural,Behavioural,mean,27.1,Unknown,NA,27.1,27.1,highest mean value for 90 days post hatch and max illuminance of 4.42E-05 W cm-2,,,,,,,,,,,,"Carvalho, PSM; Noltie, DB; Tillitt, DE 2002 Ontogenetic improvement of visual function in the medaka Oryzias latipes based on an optomotor testing system for larval and adult fish Ontogenetic improvement of visual function in the medaka Oryzias latipes based on an optomotor testing system for larval and adult fish Carvalho, PSM; Noltie, DB; Tillitt, DE",y,M,Actinopterygii,Medaka,Oryzias latipes,Oryzias_latipes,"Oryzias latipes Temminck & Schlegel, 1846",benthopelagic,low,forage,,0.21,,Behavioural,Behavioural,mean,37.2,Unknown,NA,37.2,37.2,adult (65 days post hatch) (for 10 days posthatch: 18 Hz ; for juveniles: 26 Hz) at maximum illuminance ; cannot distinguish movement of the stripes,,,,,,,,,,,,"Chatterjee, Payel; Mohan, Umesh; Krishnan, Anand; Sane, Sanjay P. 2020 Evolutionary constraints on flicker fusion frequency in Lepidoptera Evolutionary constraints on flicker fusion frequency in Lepidoptera Chatterjee, Payel; Mohan, Umesh; Krishnan, Anand; Sane, Sanjay P.",y,M,Insecta,Tawny Coster,Acraea terpsichore,Acraea_terpsichore,"Acraea terpsichore Linnaeus, 1758",volant,high,forage,,0.1,,ERG,Electrophysiology,mean,169,19.8,SE,169,183,mean and SE from AL;  155-183 Hz range of individual values ; no illuminance trial,,,,,,,,,,,,"Chatterjee, Payel; Mohan, Umesh; Krishnan, Anand; Sane, Sanjay P. 2020 Evolutionary constraints on flicker fusion frequency in Lepidoptera Evolutionary constraints on flicker fusion frequency in Lepidoptera Chatterjee, Payel; Mohan, Umesh; Krishnan, Anand; Sane, Sanjay P.",y,E,Insecta,NA,Ariadne ariadne,Ariadne_ariadne_ariadne,"Ariadne ariadne Linnaeus, 1763",volant,high,forage,,0.1,,ERG,Electrophysiology,NA,205,NA,NA,NA,205,individual values ; no illuminance trial,,,,,,,,,,,,"Chatterjee, Payel; Mohan, Umesh; Krishnan, Anand; Sane, Sanjay P. 2020 Evolutionary constraints on flicker fusion frequency in Lepidoptera Evolutionary constraints on flicker fusion frequency in Lepidoptera Chatterjee, Payel; Mohan, Umesh; Krishnan, Anand; Sane, Sanjay P.",y,E,Insecta,NA,Moduza procris,Moduza_procris_milonia,"Moduza procris Cramer, 1777",volant,high,forage,,0.1,,ERG,Electrophysiology,NA,199,NA,NA,NA,199,individual values ; no illuminance trial,,,,,,,,,,,,"Chatterjee, Payel; Mohan, Umesh; Krishnan, Anand; Sane, Sanjay P. 2020 Evolutionary constraints on flicker fusion frequency in Lepidoptera Evolutionary constraints on flicker fusion frequency in Lepidoptera Chatterjee, Payel; Mohan, Umesh; Krishnan, Anand; Sane, Sanjay P.",y,E,Insecta,Core,Euploea core,Euploea_core_godartii,"Euploea coreCramer, 1780",volant,high,forage,,0.1,,ERG,Electrophysiology,NA,208,NA,NA,NA,208,individual values ; no illuminance trial,,,,,,,,,,,,"Chatterjee, Payel; Mohan, Umesh; Krishnan, Anand; Sane, Sanjay P. 2020 Evolutionary constraints on flicker fusion frequency in Lepidoptera Evolutionary constraints on flicker fusion frequency in Lepidoptera Chatterjee, Payel; Mohan, Umesh; Krishnan, Anand; Sane, Sanjay P.",y,E,Insecta,NA,Junonia lemonias,Junonia_lemonias_lemonias,"Junonia lemonias Linnaeus, 1758",volant,high,forage,,0.1,,ERG,Electrophysiology,NA,203,NA,NA,NA,203,individual values ; no illuminance trial,,,,,,,,,,,,"Chatterjee, Payel; Mohan, Umesh; Krishnan, Anand; Sane, Sanjay P. 2020 Evolutionary constraints on flicker fusion frequency in Lepidoptera Evolutionary constraints on flicker fusion frequency in Lepidoptera Chatterjee, Payel; Mohan, Umesh; Krishnan, Anand; Sane, Sanjay P.",y,M,Insecta,Common emigrant,Catopsilia pomona,Catopsilia_pomona_pomona,"Catopsilia pomona Fabricius, 1775",volant,high,forage,,0.1,,ERG,Electrophysiology,mean,154.5,36.1,SE,154.5,180,mean and SE from AL;  129-180 Hz range of individual values ; no illuminance trial,,,,,,,,,,,,"Chatterjee, Payel; Mohan, Umesh; Krishnan, Anand; Sane, Sanjay P. 2020 Evolutionary constraints on flicker fusion frequency in Lepidoptera Evolutionary constraints on flicker fusion frequency in Lepidoptera Chatterjee, Payel; Mohan, Umesh; Krishnan, Anand; Sane, Sanjay P.",y,M,Insecta,Mottled Emigrant,Catopsilia pyranthe,Catopsilia_pyranthe_pyranthe,"Catopsilia pyranthe Linnaeus, 1758",volant,high,forage,,0.1,,ERG,Electrophysiology,mean,181.5,15.5,SE,181.5,194,mean and SE from AL;  159-194 Hz range of individual values ; no illuminance trial,,,,,,,,,,,,"Chatterjee, Payel; Mohan, Umesh; Krishnan, Anand; Sane, Sanjay P. 2020 Evolutionary constraints on flicker fusion frequency in Lepidoptera Evolutionary constraints on flicker fusion frequency in Lepidoptera Chatterjee, Payel; Mohan, Umesh; Krishnan, Anand; Sane, Sanjay P.",y,E,Insecta,Indian wanderer,Pareronia hippia,Pareronia_ceylanica,"Pareronia valeria Cramer, 1776",volant,high,forage,,0.1,,ERG,Electrophysiology,NA,113.25,NA,NA,NA,113.25,individual values ; no illuminance trial,,,,,,,,,,,,"Chatterjee, Payel; Mohan, Umesh; Krishnan, Anand; Sane, Sanjay P. 2020 Evolutionary constraints on flicker fusion frequency in Lepidoptera Evolutionary constraints on flicker fusion frequency in Lepidoptera Chatterjee, Payel; Mohan, Umesh; Krishnan, Anand; Sane, Sanjay P.",y,E,Insecta,common Jezebel,Delias eucharis,Delias_eucharis,"Delias eucharis Drury, 1773",volant,high,forage,,0.1,,ERG,Electrophysiology,NA,140.4,NA,NA,NA,140.4,individual values ; no illuminance trial,,,,,,,,,,,,"Chatterjee, Payel; Mohan, Umesh; Krishnan, Anand; Sane, Sanjay P. 2020 Evolutionary constraints on flicker fusion frequency in Lepidoptera Evolutionary constraints on flicker fusion frequency in Lepidoptera Chatterjee, Payel; Mohan, Umesh; Krishnan, Anand; Sane, Sanjay P.",y,E,Insecta,NA,Agrius convolvuli,Agrius_convolvuli,"Agrius convolvuli Linnaeus, 1758",volant,low,forage,,0.1,,ERG,Electrophysiology,NA,174.8,NA,NA,NA,174.8,individual values ; no illuminance trial,,,,,,,,,,,,